filename, description, size, checksum
seagull_report.pdf, "Latest analysis of the seagull population", 643882, b87078849a142e1b00db02744b4848a6
heron_count.xlsx, "Figures from the heron spotters' research council", 0, 6f001f5c3f0fd68391a6e58d5407ab30
untitled_goose_game.exe, "Report on goose behaviour", 4830800, b87078849a142e1b00db02744b4848a6
"bug hotel trends.docx", "Ants and bees etc.", 0, 6f001f5c3f0fd68391a6e58d5407ab30
"find swans.exe", "Program for locating the nearest swan", 6989929, 2dde8f4a54402c26b1d3d3d0a24a0de3
HERON.JPG, "Portrait of a heron", 861, 8b02cb1e705e1d457cf3dce0852eabb1
moorhens.exe, "Moorhen simulator", 0, 6f001f5c3f0fd68391a6e58d5407ab30
